{"body_reads":"0","entries":[{"kind":"file","mode":"33188","mtime_ns":"1782988487000000000","path_digest":"a96109b69180dd3c540964fb2f780d855564c7d0bfd8cab8453c1358da764c77","relative_path":"AGENT_RULES.md","size_bytes":"1245"},{"kind":"file","mode":"33188","mtime_ns":"1783047538000000000","path_digest":"6f7005f7a7a20953ea04d071c9ad508a2c23fc894ee40a292c7f66278814c12d","relative_path":"INDEX.md","size_bytes":"1822"},{"kind":"file","mode":"33188","mtime_ns":"1782988529000000000","path_digest":"ba2b489ce2ac67a26a5ba9aea907a6da0418657d50104f0a7864909ec7fb4788","relative_path":"faq/_template.md","size_bytes":"172"},{"kind":"file","mode":"33188","mtime_ns":"1783005038000000000","path_digest":"3eb8b886cfa22baedb202cde7305d1f7989200380fd39ce76871c451e47cd015","relative_path":"identity/profile.md","size_bytes":"937"},{"kind":"file","mode":"33188","mtime_ns":"1782988529000000000","path_digest":"740d0013b89a78df5dfa27d5b766f615b733bc6146d3f09b182405258e4b70ef","relative_path":"ops/_template.md","size_bytes":"228"},{"kind":"file","mode":"33188","mtime_ns":"1783047538000000000","path_digest":"6ef18e0dbfc1ee838c1adaa1bfa7d0a7c3bb87968c5179861527dbf80b329395","relative_path":"ops/repo-cleanup.md","size_bytes":"1473"},{"kind":"file","mode":"33188","mtime_ns":"1782988529000000000","path_digest":"90458a5722a3c6633864e52c652f9fbfdbc80e83a4ade44a9314ed3cd6258ced","relative_path":"people/_template.md","size_bytes":"139"},{"kind":"file","mode":"33188","mtime_ns":"1782988497000000000","path_digest":"73bdfbf8e3df39e71498e93dc5e50f1aa4222a3c23403556c39b870f102d2332","relative_path":"principles/_template.md","size_bytes":"408"},{"kind":"file","mode":"33188","mtime_ns":"1783005006000000000","path_digest":"6c5149f39d194ea2e4ce022f2f299a6f71a08abce336d237da840fb6021de696","relative_path":"principles/pricing.md","size_bytes":"1105"},{"kind":"file","mode":"33188","mtime_ns":"1783005017000000000","path_digest":"0285df881879e32db4d9570eeab4f74289d2706593d64894dd6704d6a1efea2d","relative_path":"principles/prioritization.md","size_bytes":"858"},{"kind":"file","mode":"33188","mtime_ns":"1783005011000000000","path_digest":"3470d9f6ed1be9116c5ed71fb52835bbf54fc59054f489a588e86d629c5077a5","relative_path":"principles/work-acceptance.md","size_bytes":"852"},{"kind":"file","mode":"33188","mtime_ns":"1783047538000000000","path_digest":"9b2cc21d1dc3fba0076417ae0e17995d12db41737422a4fd2a1735a69a786d70","relative_path":"projects/agentgauge.md","size_bytes":"555"},{"kind":"file","mode":"33188","mtime_ns":"1783007997000000000","path_digest":"606bda9ece5ad0a4280c33bc9f48b800978cfb25f293bb51b8ae3ec1feae730d","relative_path":"projects/blro-os.md","size_bytes":"1733"},{"kind":"file","mode":"33188","mtime_ns":"1783047538000000000","path_digest":"f9ef2197450b88fba9ce38de59396ff7e78ad7b1f40a66335cf3241898eca521","relative_path":"projects/jarvis-ai.md","size_bytes":"292"},{"kind":"file","mode":"33188","mtime_ns":"1783006529000000000","path_digest":"743e046208b5b0549d5ed014eb3b0ebd048fb4522a3be4017166712fbdbfb98e","relative_path":"projects/unified-db.md","size_bytes":"886"},{"kind":"file","mode":"33188","mtime_ns":"1782988529000000000","path_digest":"ab46d172e2c76cb23b97682a90e53759f31c72bb968e66373245b30f16a7fd52","relative_path":"voice/_template.md","size_bytes":"288"},{"kind":"file","mode":"33188","mtime_ns":"1783005028000000000","path_digest":"e8afcd6f91a5bde57b2efad48a6c1c0b248f859b0ba8f651e1592bd75249f896","relative_path":"voice/customer-email.md","size_bytes":"1354"}],"entry_count":"17","manifest_digest":"aaf942e7700d6d728cc0bd5f1c9ffcf934dd9900f8130caee25b2743faa2dba8","manifest_version":"second-brain-source-discovery-manifest-v1","request_version":"second-brain-source-discovery-request-v1","source_name":"me-wiki","source_root":"/Volumes/DevSpace/me-wiki"}
